{
  "$schema"      : "../rkn-schema.json",
  "name"         : "Nystrom5VelocityIndependent",
  "description"  : "Fifth-order Runge--Kutta--Nystrom method for velocity-independent acceleration.",
  "kind"         : "fixed-runge-kutta-nystrom",
  "order"        : 5,
  "A"            : [
    [0,0,0,0],
    ["1.0 / 50.0",0,0,0],
    ["-1.0 / 27.0","7.0 / 27.0",0,0],
    ["3.0 / 10.0","-2.0 / 35.0","9.0 / 35.0",0]
  ],
  "b"            : ["14.0 / 336.0","100.0 / 336.0","54.0 / 336.0","0.0"],
  "b_velocity"   : ["14.0 / 336.0","125.0 / 336.0","162.0 / 336.0","35.0 / 336.0"],
  "c"            : ["0.0","1.0 / 5.0","2.0 / 3.0","1.0"]
}
