{
  "$schema"             : "../rkn-schema.json",
  "name"                : "Dprkn12",
  "description"         : "Dormand--Prince twelfth-order adaptive Runge--Kutta--Nystrom method.",
  "kind"                : "adaptive-runge-kutta-nystrom",
  "order"               : 12,
  "A"                   : [
    ["0.0","0.0","0.0","0.0","0.0","0.0","0.0","0.0","0.0","0.0","0.0","0.0","0.0","0.0","0.0","0.0","0.0"],
    ["0.00020000000000000001","0.0","0.0","0.0","0.0","0.0","0.0","0.0","0.0","0.0","0.0","0.0","0.0","0.0","0.0","0.0","0.0"],
    ["0.00026666666666666668","0.00053333333333333336","0.0","0.0","0.0","0.0","0.0","0.0","0.0","0.0","0.0","0.0","0.0","0.0","0.0","0.0","0.0"],
    ["0.0029166666666666668","-0.0041666666666666666","0.0062500000000000003","0.0","0.0","0.0","0.0","0.0","0.0","0.0","0.0","0.0","0.0","0.0","0.0","0.0","0.0"],
    ["0.0016460905349794238","0.0","0.0054869684499314125","0.0017558299039780521","0.0","0.0","0.0","0.0","0.0","0.0","0.0","0.0","0.0","0.0","0.0","0.0","0.0"],
    ["0.0019456","0.0","0.0071517460317460316","0.0029127111111111113","0.00078994285714285709","0.0","0.0","0.0","0.0","0.0","0.0","0.0","0.0","0.0","0.0","0.0","0.0"],
    ["0.00056640624999999996","0.0","0.00088097304894179892","-0.00043692129629629631","0.00033900669642857143","-9.9464699074074069e-05","0.0","0.0","0.0","0.0","0.0","0.0","0.0","0.0","0.0","0.0","0.0"],
    ["0.0030833333333333333","0.0","0.0","0.0017777777777777779","0.0027000000000000001","0.0015782828282828283","0.01086060606060606","0.0","0.0","0.0","0.0","0.0","0.0","0.0","0.0","0.0","0.0"],
    ["0.0036518393748011298","0.0","0.0039651717140723429","0.0031972582629306284","0.0082214673068554348","-0.0013130926959572379","0.0097715869680648684","0.0037557690692328338","0.0","0.0","0.0","0.0","0.0","0.0","0.0","0.0","0.0"],
    ["0.003707241068718501","0.0","0.0050820458545552854","0.001174708002175412","-0.021147629915126993","0.060104636981078811","0.020105734768506186","-0.028350750122933581","0.014879568918581932","0.0","0.0","0.0","0.0","0.0","0.0","0.0","0.0"],
    ["0.035125376560733439","0.0","-0.008615749195138479","-0.0057914480510079169","1.9455548237826159","-3.4351238674565141","-0.10930701107475221","2.3496383118995166","-0.75600940868702304","0.10952897222156927","0.0","0.0","0.0","0.0","0.0","0.0","0.0"],
    ["0.020527792537482496","0.0","-0.0072864467644801782","-0.0021153556079618403","0.92758079687235218","-1.6522824844257367","-0.021079563005686568","1.2065364326207872","-0.41371447700106612","0.090798739828096539","0.0053555526005339849","0.0","0.0","0.0","0.0","0.0","0.0"],
    ["-0.14324078875545515","0.0","0.012528703773091817","0.0068260191639698273","-4.7995553955743873","5.6986250439519415","0.75534303695236449","-0.12755487858281084","-1.9605926051117386","0.91856090566352622","-0.23880085505284429","0.15911081357234216","0.0","0.0","0.0","0.0","0.0"],
    ["0.80450192055204894","0.0","-0.016658527067011247","-0.021415834042629738","16.827235928962466","-11.172835357176098","-3.3771592972263238","-15.243326655360846","17.179835738215417","-5.4377192398239949","1.3878671618364655","-0.59258277326528108","0.029603873171297354","0.0","0.0","0.0","0.0"],
    ["-0.91329676669735804","0.0","0.0024112725757805178","0.017658122693861741","-14.851649779720384","2.1589708670045757","3.9979155831178801","28.434151800232232","-25.259364354941599","7.7338785423622376","-1.8913028948478674","1.0014845070224718","0.0046411995991090518","0.011218755022148957","0.0","0.0","0.0"],
    ["-0.27519629720559396","0.0","0.036611888779154923","0.009789519688231562","-12.293062345886211","14.207226453937903","1.5866476906789537","2.4577735327595946","-8.9351936944032726","4.3736727316134072","-1.8347181765449492","1.1592085289061491","-0.01729025316538392","0.019325977904460768","0.0052044429375549929","0.0","0.0"],
    ["1.3076391847404059","0.0","0.017364109189745843","-0.018544456454265796","14.811522032867726","9.3831763084824704","-5.2284261999445425","-48.95128052584765","38.297096034337926","-10.58738133697598","2.4332304376226275","-1.0453406042575444","0.071773209508672595","0.0021622109708082783","0.0070095957596025141","0.0","0.0"]
  ],
  "b"                   : ["0.012127868517185414","0.0","0.0","0.0","0.0","0.0","0.086297462515688747","0.25254695811871469","-0.19741867993268231","0.2031869190789726","-0.020775808077714918","0.10967804874502014","0.038065132526466504","0.01163406880432423","0.0046580297040248785","0.0","0.0"],
  "b_velocity"          : ["0.012127868517185414","0.0","0.0","0.0","0.0","0.0","0.090839434227040786","0.31568369764839338","-0.26322490657690972","0.30478037861845891","-0.041551616155429835","0.2467756096762953","0.15226053010586602","0.081438481630269607","0.085025711938908108","-0.0091551896300779631","0.025000000000000001"],
  "c"                   : ["0.0","0.02","0.040000000000000001","0.10000000000000001","0.13333333333333333","0.16","0.050000000000000003","0.20000000000000001","0.25","0.33333333333333331","0.5","0.55555555555555558","0.75","0.8571428571428571","0.94521622227201429","1.0","1.0"],
  "error"               : ["-0.0048808333898215771","0.0","0.0","0.0","0.0","0.0","0.014038126584857338","-0.11947921920803832","0.20440246507662121","-0.13226814922237909","0.11053069299761689","-0.079753857871028511","0.011224330486437457","-0.0046715968015936943","0.00085804134732828411","0.0","0.0"],
  "velocity_error"      : ["-0.0048808333898215771","0.0","0.0","0.0","0.0","0.0","0.014776975352481408","-0.1493490240100479","0.27253662010216162","-0.19840222383356862","0.22106138599523378","-0.17944618020981415","0.04489732194574983","-0.03270117761115586","0.015662325288859434","-0.029155189630077964","0.025000000000000001"]
}
