{
  "$schema"             : "../rkn-schema.json",
  "name"                : "Erkn4",
  "description"         : "Embedded fourth-order Runge--Kutta--Nystrom method.",
  "kind"                : "adaptive-runge-kutta-nystrom",
  "order"               : 4,
  "A"                   : [
    ["0.0","0.0","0.0","0.0"],
    ["0.03125","0.0","0.0","0.0"],
    ["0.031666666666666669","0.21333333333333335","0.0","0.0"],
    ["0.10158730158730159","0.18412698412698414","0.21428571428571427","0.0"]
  ],
  "b"                   : ["0.047619047619047616","0.34567901234567899","0.088183421516754845","0.018518518518518517"],
  "b_velocity"          : ["0.071428571428571425","0.39506172839506171","0.44091710758377423","0.092592592592592587"],
  "c"                   : ["0.0","0.25","0.69999999999999996","1.0"],
  "error"               : ["0.010285714285714285","-0.016987654320987654","0.0081834215167548505","-0.0014814814814814814"],
  "velocity_error"      : ["-0.0021645021645021645","0.0044893378226711564","-0.0040083373416706751","0.0016835016835016834"]
}
