{
  "$schema"             : "../rkn-schema.json",
  "name"                : "Erkn5",
  "description"         : "Embedded fifth-order Runge--Kutta--Nystrom method with position-only error control.",
  "kind"                : "adaptive-runge-kutta-nystrom",
  "order"               : 5,
  "A"                   : [
    ["0.0","0.0","0.0","0.0"],
    ["0.125","0.0","0.0","0.0"],
    ["0.008475218658892128","0.028361516034985424","0.0","0.0"],
    ["0.051539076300366506","0.11592236875149756","0.20470310704348388","0.0"]
  ],
  "b"                   : ["0.09549441786283891","0.13231981981981983","0.22715444164651324","0.045031320670828011"],
  "b_velocity"          : ["0.09549441786283891","0.26463963963963966","0.31178060618148878","0.32808533631603265"],
  "c"                   : ["0.0","0.5","0.27142857142857141","0.86274509803921573"],
  "error"               : ["0.0040247827360609311","0.011367291781577495","-0.012845558353486749","-0.0025465161641516788"],
  "position_only_error" : true
}
