{
  "$schema"             : "../rkn-schema.json",
  "name"                : "Dprkn6",
  "description"         : "Dormand--Prince sixth-order adaptive RKN method with free sixth-order dense output.",
  "kind"                : "adaptive-runge-kutta-nystrom",
  "order"               : 6,
  "A"                   : [
    ["0.0","0.0","0.0","0.0","0.0","0.0"],
    ["0.0083587152839680254","0.0","0.0","0.0","0.0","0.0"],
    ["0.011144953711957367","0.022289907423914734","0.0","0.0","0.0","0.0"],
    ["0.14547474280109179","-0.22986064052264749","0.30903498720296751","0.0","0.0","0.0"],
    ["-0.20766826295078997","0.6863667842925143","-0.19954927787234925","0.12585075653062489","0.0","0.0"],
    ["0.07811016144349478","0.0","0.2882917411897668","0.12242553717457041","0.011172560192168035","0.0"]
  ],
  "b"                   : ["0.07811016144349478","0.0","0.2882917411897668","0.12242553717457041","0.011172560192168035","0.0"],
  "b_velocity"          : ["0.07811016144349478","0.0","0.38884347870598263","0.37132075792884228","0.11172560192168035","0.050000000000000003"],
  "c"                   : ["0.0","0.12929590313670442","0.25859180627340883","0.67029708261548004","0.90000000000000002","1.0"],
  "error"               : ["-0.98074909892692352","2.406751371924452","-1.5596003703642669","0.12242553717457041","0.011172560192168035","0.0"],
  "velocity_error"      : ["0.023504273504273504","0.0","-0.072423307197644241","0.17543989844952962","-0.27652086475615889","0.14999999999999999"],
  "dense"               : [
    ["0.5","-1.245014245014245","1.5161443494776827","-0.90669515669515666","0.21367521367521367"],
    ["0.0","0.0","0.0","0.0","0.0"],
    ["0.0","1.9859371988705032","-3.5776528722949208","2.5384011164109506","-0.65839370179676582"],
    ["0.0","-1.8559358276926614","5.5475867510523287","-5.1641335539080941","1.5949081677229964"],
    ["0.0","2.1786492374727668","-6.9269873191441818","7.2733366851013912","-2.5138260432378079"],
    ["0.0","-1.0636363636363637","3.4409090909090909","-3.7409090909090907","1.3636363636363635"]
  ],
  "velocity_dense"      : [
    ["1.0","-3.7350427350427351","6.0645773979107309","-4.5334757834757831","1.2820512820512822"],
    ["0.0","0.0","0.0","0.0","0.0"],
    ["0.0","5.9578115966115099","-14.310611489179683","12.692005582054751","-3.9503622107805949"],
    ["0.0","-5.567807483077984","22.190347004209315","-25.820667769540467","9.5694490063379796"],
    ["0.0","6.5359477124183005","-27.707949276576727","36.366683425506956","-15.082956259426847"],
    ["0.0","-3.1909090909090909","13.763636363636364","-18.704545454545453","8.1818181818181817"]
  ]
}
